{
  "jobId": "5c8******************0d1",
  "account": "5be******************e57",
  "pickupLocation": {
    "location": "5ea******************4a9"
  },
  "deliveryLocations": [
    {
      "orderId": "5f4******************2af",
      "channelOrderDisplayId": "MT4YVTPL",
      "deliveryId": "ABC567"
    }
  ],
  "courier": {
    "courierId": "D1234"
  }
}